{
  "blocked_reasons": [],
  "class_distribution": {
    "EXPIRED": 47922,
    "STOP_FIRST": 146567,
    "TARGET_FIRST": 146567
  },
  "coefficients": {
    "atr_14_over_close": -0.13341879720176322,
    "direction_is_long": -0.011986827425379888,
    "direction_is_short": 0.011986827425379888,
    "of_delta_over_of_volume": 0.0019363340273503501,
    "of_delta_sum_14_over_of_volume_sum_14": 0.0011994763101689453,
    "of_trades_per_minute": -0.044858302364371654,
    "of_trades_vs_14bar_avg": 0.07684928623606826,
    "of_volume_per_trade": -0.046653058116624194,
    "of_volume_vs_14bar_avg": 0.06909751888242849,
    "range_over_atr": 0.048011508077487025,
    "ret_1": 0.000745277064066272,
    "ret_14": -0.009476177097002443,
    "ret_4": 0.0011960774104212903,
    "ret_8": -0.005987255796131518
  },
  "comparison_metrics": {
    "baseline_run_id": "9e6150e844b0a1cd107e01bf609be0d06bd3ed4bbf2c5eb90f597c6fae49adfe",
    "previous_model_run_id": "2bcf697a07beaa16d487a4f3df83491b826500be1f55a0acaf2bd2efa293414d",
    "test_accuracy_delta_vs_baseline": 0.0003820505696026655,
    "test_accuracy_delta_vs_previous_model": 0.0011287857738260798,
    "test_expected_r_per_candidate_delta_vs_previous_model": 0.0011336117278897852,
    "validation_accuracy_delta_vs_baseline": 0.0017748591205573039,
    "validation_accuracy_delta_vs_previous_model": -0.0006433864312019866,
    "validation_expected_r_per_candidate_delta_vs_previous_model": -0.0006002137064462804
  },
  "created_at": "2026-09-07T14:49:45.431107Z",
  "dataset_id": "f9d3c1b0d02da255a89dcbd01033106c51da389e25bb38f3307b9b1dc0c6e966",
  "dataset_version": "gc-30m-real-dataset-builder-0.1.0",
  "excluded_raw_features": [
    {
      "feature": "close",
      "reason": "RAW_PRICE_FEATURE_EXCLUDED_FOR_REGIME_DRIFT"
    },
    {
      "feature": "atr_14",
      "reason": "RAW_ATR_FEATURE_EXCLUDED_FOR_REGIME_DRIFT"
    }
  ],
  "feature_names": [
    "ret_1",
    "ret_4",
    "ret_8",
    "ret_14",
    "range_over_atr",
    "direction_is_long",
    "direction_is_short",
    "atr_14_over_close",
    "of_delta_over_of_volume",
    "of_delta_sum_14_over_of_volume_sum_14",
    "of_trades_per_minute",
    "of_volume_per_trade",
    "of_volume_vs_14bar_avg",
    "of_trades_vs_14bar_avg"
  ],
  "feature_schema_version": "gc-normalized-feature-schema-0.1.0",
  "final_evaluation_scope": "TEST_ONLY",
  "fit_scope": "TRAIN_ONLY",
  "intercept": -0.007195649603128072,
  "label_version": "gc-outcome-contract-label-0.1.0",
  "metrics": {
    "test_accuracy": 0.4408342595165324,
    "test_balanced_accuracy": 0.3336224684251337,
    "test_binary_accuracy": 0.5520978049458183,
    "test_expected_r_if_all_candidates": 0.0,
    "test_expected_r_per_candidate": 0.00038432494158456814,
    "test_expected_r_per_selected_trade": 0.0010412122999861571,
    "test_selected_trade_rate": 0.36911294804112255,
    "test_target_precision": 0.48990825688073397,
    "test_target_recall": 0.4105586878523834,
    "validation_accuracy": 0.4241247725961752,
    "validation_balanced_accuracy": 0.3347341142687048,
    "validation_binary_accuracy": 0.5676443182322403,
    "validation_expected_r_per_candidate": 0.0018140593341341342,
    "validation_expected_r_per_selected_trade": 0.003399447487912608,
    "validation_selected_trade_rate": 0.533633580334561,
    "validation_target_precision": 0.49062487007857647,
    "validation_target_recall": 0.6198980931869518
  },
  "model_type": "REGULARIZED_LOGISTIC_NORMALIZED_FEATURE_RESEARCH",
  "model_version": "normalized-feature-logistic-research-0.1.0",
  "promotion_allowed": false,
  "run_id": "a7f6f9b285724680f7fa240d4b6e7d581afcae492a99dbbe6cd4623f4c78ba7b",
  "run_version": "gc-normalized-feature-model-run-0.1.0",
  "selected_threshold": 0.49999999999999994,
  "selection_scope": "VALIDATION_ONLY",
  "source_baseline_run_id": "9e6150e844b0a1cd107e01bf609be0d06bd3ed4bbf2c5eb90f597c6fae49adfe",
  "source_feature_candidates_report_id": "ea990a5cbf35f3e4f961d7062ac6f00f618c3691515c8e4117d3fde84b86b57c",
  "source_feature_candidates_report_version": "gc-normalized-feature-candidates-report-0.1.0",
  "source_previous_model_run_id": "2bcf697a07beaa16d487a4f3df83491b826500be1f55a0acaf2bd2efa293414d",
  "split_summary": {
    "TEST": 57584,
    "TRAIN": 238398,
    "VALIDATION": 45074
  },
  "status": "TRAINED",
  "threshold_selection_metric": "validation_expected_r_per_candidate",
  "training_parameters": {
    "epochs": 220,
    "feature_candidate_gate": "PHASE_51_NORMALIZED_FEATURE_CANDIDATES",
    "feature_materialization": "ZERO_SAFE_NORMALIZED_RATIOS",
    "l2": 0.01,
    "learning_rate": 0.08,
    "negative_classes": "STOP_FIRST_OR_EXPIRED",
    "solver": "in_repo_batch_gradient_descent",
    "target_class": "TARGET_FIRST"
  },
  "training_policy_version": "baseline-training-policy-0.1.0"
}
